{
  "$schema": "http://json-schema.org/draft-07/schema#",
  "$id": "https://sam-framework.dev/schemas/spell.schema.json",
  "title": "S.A.M Spell",
  "description": "Defines a custom spell. S.A.M's spell loader registers it into its runtime spell registry at a reserved id (>=2000) so it can be referenced by name ('namespace:spell'). The spell casts like the vanilla spell its 'payload' names, and shows in the spell list with its name and icon. Nothing grants it by itself: add its id to a class's or race's starting_spells, call sam_grant_spell, or give your mod a spellbook item whose spellbook_spell is this spell. Fields that are saved but not used yet: speed, and damage_min (it only decides whether the tooltip shows a damage tag; damage_max sets the damage).",
  "type": "object",
  "additionalProperties": false,
  "required": [
    "id",
    "name",
    "payload"
  ],
  "properties": {
    "$schema": {
      "type": "string",
      "description": "Optional. URL of this JSON Schema, so editors give autocomplete + validation as you type. Ignored by S.A.M itself."
    },
    "id": {
      "type": "string",
      "pattern": "^[a-z][a-z0-9_]*:[a-z][a-z0-9_]*$",
      "description": "Unique spell id in 'namespace:spell' form (e.g. 'darkmage:shadow_bolt'). S.A.M assigns the runtime numeric spell id (>=2000) automatically."
    },
    "name": {
      "type": "string",
      "minLength": 1,
      "description": "Display name of the spell (e.g. 'Shadow Bolt')."
    },
    "description": {
      "type": "string",
      "description": "Short flavor/description text shown for the spell."
    },
    "mana_cost": {
      "type": "integer",
      "minimum": 0,
      "default": 1,
      "description": "Mana required to cast the spell."
    },
    "difficulty": {
      "type": "integer",
      "default": 0,
      "minimum": 0,
      "description": "Magic skill (Spellcasting proficiency + INT) needed to LEARN this from a book. 0 (default) means any character can learn it, even a low-INT melee class. Raise it to gate the spell behind magic skill like a vanilla spellbook."
    },
    "projectile_type": {
      "enum": [
        "missile",
        "missile_trio",
        "none"
      ],
      "default": "missile",
      "description": "How the spell is delivered. 'missile' = a single bolt (Barony PROPULSION_MISSILE / spell_element_missile root). 'missile_trio' = a 3-way spread (PROPULSION_MISSILE_TRIO / spell_element_trio). 'none' only marks the tooltip as a self spell: the spell still fires its bolt, so a spell that must not shoot needs a script on player.on_spell_cast that returns false."
    },
    "payload": {
      "enum": [
        "force",
        "fire",
        "lightning",
        "cold",
        "magic_missile",
        "poison",
        "slow",
        "confuse",
        "sleep",
        "dig",
        "dominate",
        "charm_monster",
        "acid_spray",
        "bleed",
        "ghost_bolt",
        "stoneblood",
        "locking",
        "opening",
        "tele_pull",
        "steal_weapon",
        "drain_soul"
      ],
      "description": "The spell's effect payload — maps 1:1 to a real Barony spell element (e.g. 'fire' -> spell_element_fireball, 'force' -> spell_element_forcebolt, 'charm_monster' -> spell_element_charm, 'magic_missile' -> spell_element_magicmissile). Determines the bolt's on-hit behavior."
    },
    "damage_min": {
      "type": "integer",
      "minimum": 0,
      "description": "Not used by the bolt: damage_max sets the damage. Setting either number only adds a damage tag to the tooltip."
    },
    "damage_max": {
      "type": "integer",
      "minimum": 0,
      "description": "Damage the bolt deals (the payload's damage is set to this). Leave it out to keep the payload's own damage."
    },
    "range": {
      "type": "integer",
      "minimum": 0,
      "description": "How long the bolt lives, in game ticks (50 per second). The engine default is 75, roughly a corridor's length. This is a lifetime, not a distance in tiles: 6 here is a bolt that vanishes at the caster's fingertips. Omit it to keep the default."
    },
    "speed": {
      "type": "integer",
      "minimum": 0,
      "description": "Not used yet: the bolt keeps the payload's speed."
    },
    "on_hit_effect": {
      "type": "string",
      "description": "Optional. Status effect applied to whatever the bolt hits: a built-in name such as 'EFF_POISONED', or one of your own custom effects by its exact id ('namespace:effect', lowercase, e.g. 'mymod:plague'). A name that matches nothing is ignored, with one warning line in sam_log.txt. For payloads that apply a status of their own (slow, confuse, sleep and similar) it applies only when that status lands too. It applies whenever the bolt reports a hit: never for ghost_bolt or dig, for steal_weapon only when a weapon is actually taken, and for charm_monster only when the charm or pacify lands."
    },
    "on_hit_duration": {
      "type": "integer",
      "minimum": 0,
      "description": "Optional. Duration in game ticks (50/sec) of on_hit_effect. 0 or left out uses the custom effect's own duration_ticks, otherwise 250 ticks (5 seconds)."
    },
    "on_hit_chance": {
      "type": "integer",
      "minimum": 0,
      "maximum": 100,
      "description": "Optional. Percent chance (0-100) that on_hit_effect triggers on a hit. 0 or left out means every hit."
    },
    "icon": {
      "type": "string",
      "description": "Optional. Path (relative to the mod folder) to a PNG spell icon, e.g. 'spells/shadow_bolt.png'."
    },
    "starting_spell": {
      "type": "boolean",
      "default": false,
      "description": "Optional. Hint that this spell is intended as a class starting spell. Actual granting is driven by a class's 'starting_spells' array (which may list this spell's 'namespace:spell' id)."
    }
  },
  "examples": [
    {
      "id": "darkmage:shadow_bolt",
      "name": "Shadow Bolt",
      "description": "A bolt of condensed shadow that saps the life from its target.",
      "mana_cost": 8,
      "projectile_type": "missile",
      "payload": "drain_soul",
      "damage_min": 10,
      "damage_max": 18,
      "range": 20,
      "speed": 6,
      "on_hit_effect": "EFF_SLOW",
      "on_hit_duration": 100,
      "on_hit_chance": 50,
      "icon": "spells/shadow_bolt.png",
      "starting_spell": true
    }
  ]
}
